{
  "$schema": "https://json-schema.org/draft/2020-12/schema",
  "type": "object",
  "properties": {
    "evaluationId": {
      "type": "string",
      "const": "T09"
    },
    "caseId": {
      "type": "string",
      "const": "EXAMPLE-01"
    },
    "contentVersion": {
      "type": "number",
      "const": 1
    },
    "synthetic": {
      "type": "boolean",
      "const": true
    },
    "contentApproval": {
      "type": "string",
      "const": "approved"
    },
    "approvalRef": {
      "type": "string",
      "const": "BUSINESS-BASELINE-01"
    },
    "expectationOnly": {
      "type": "boolean",
      "const": true
    },
    "roleId": {
      "type": "string"
    },
    "input": {
      "type": "string",
      "minLength": 1
    },
    "correction": {
      "type": "object",
      "properties": {
        "target": {
          "type": "object",
          "properties": {
            "fieldId": {
              "type": "string",
              "enum": [
                "A01",
                "A02",
                "A03",
                "A04",
                "A05",
                "A06",
                "A07",
                "A08",
                "B01",
                "B02",
                "B03",
                "B04",
                "B05",
                "B06",
                "B07",
                "C01",
                "C02",
                "C03",
                "C04",
                "C05",
                "C06",
                "C07",
                "C08",
                "D01",
                "D02",
                "D03",
                "D04",
                "D05",
                "E01",
                "E02",
                "E03",
                "E04",
                "E05",
                "E06",
                "E07",
                "E08",
                "E09",
                "F01",
                "F02",
                "F03",
                "F04",
                "F05",
                "F06",
                "F07",
                "G01",
                "G02",
                "G03",
                "G04",
                "G05",
                "H01",
                "H02",
                "H03",
                "H04",
                "H05",
                "H06",
                "H07",
                "H08",
                "H09",
                "H10",
                "I01",
                "I02",
                "I03",
                "I04",
                "I05",
                "I06",
                "J01",
                "J02",
                "J03",
                "J04",
                "J05",
                "K01",
                "K02",
                "K03",
                "K04",
                "K05",
                "K06",
                "K07",
                "L01",
                "L02",
                "L03",
                "L04",
                "L05",
                "L06",
                "L07",
                "M01",
                "M02",
                "M03",
                "M04",
                "M05",
                "M06",
                "M07",
                "M08",
                "M09",
                "M10",
                "N01",
                "N02",
                "N03",
                "N04",
                "N05",
                "N06",
                "O01",
                "O02",
                "O03",
                "O04",
                "O05",
                "O06",
                "O07",
                "O08",
                "O09",
                "P01",
                "P02",
                "P03",
                "P04",
                "P05",
                "P06",
                "P07",
                "P08"
              ]
            },
            "recordId": {
              "type": "string"
            }
          },
          "required": [
            "fieldId"
          ],
          "additionalProperties": false
        },
        "from": {
          "type": "number"
        },
        "to": {
          "type": "number"
        },
        "text": {
          "type": "string"
        }
      },
      "required": [
        "target",
        "from",
        "to",
        "text"
      ],
      "additionalProperties": false
    },
    "questions": {
      "minItems": 3,
      "maxItems": 3,
      "type": "array",
      "items": {
        "type": "object",
        "properties": {
          "id": {
            "type": "string"
          },
          "target": {
            "type": "object",
            "properties": {
              "fieldId": {
                "type": "string",
                "enum": [
                  "A01",
                  "A02",
                  "A03",
                  "A04",
                  "A05",
                  "A06",
                  "A07",
                  "A08",
                  "B01",
                  "B02",
                  "B03",
                  "B04",
                  "B05",
                  "B06",
                  "B07",
                  "C01",
                  "C02",
                  "C03",
                  "C04",
                  "C05",
                  "C06",
                  "C07",
                  "C08",
                  "D01",
                  "D02",
                  "D03",
                  "D04",
                  "D05",
                  "E01",
                  "E02",
                  "E03",
                  "E04",
                  "E05",
                  "E06",
                  "E07",
                  "E08",
                  "E09",
                  "F01",
                  "F02",
                  "F03",
                  "F04",
                  "F05",
                  "F06",
                  "F07",
                  "G01",
                  "G02",
                  "G03",
                  "G04",
                  "G05",
                  "H01",
                  "H02",
                  "H03",
                  "H04",
                  "H05",
                  "H06",
                  "H07",
                  "H08",
                  "H09",
                  "H10",
                  "I01",
                  "I02",
                  "I03",
                  "I04",
                  "I05",
                  "I06",
                  "J01",
                  "J02",
                  "J03",
                  "J04",
                  "J05",
                  "K01",
                  "K02",
                  "K03",
                  "K04",
                  "K05",
                  "K06",
                  "K07",
                  "L01",
                  "L02",
                  "L03",
                  "L04",
                  "L05",
                  "L06",
                  "L07",
                  "M01",
                  "M02",
                  "M03",
                  "M04",
                  "M05",
                  "M06",
                  "M07",
                  "M08",
                  "M09",
                  "M10",
                  "N01",
                  "N02",
                  "N03",
                  "N04",
                  "N05",
                  "N06",
                  "O01",
                  "O02",
                  "O03",
                  "O04",
                  "O05",
                  "O06",
                  "O07",
                  "O08",
                  "O09",
                  "P01",
                  "P02",
                  "P03",
                  "P04",
                  "P05",
                  "P06",
                  "P07",
                  "P08"
                ]
              },
              "recordId": {
                "type": "string"
              }
            },
            "required": [
              "fieldId"
            ],
            "additionalProperties": false
          },
          "text": {
            "type": "string"
          },
          "reason": {
            "type": "string"
          }
        },
        "required": [
          "id",
          "target",
          "text",
          "reason"
        ],
        "additionalProperties": false
      }
    },
    "answers": {
      "minItems": 2,
      "maxItems": 2,
      "type": "array",
      "items": {
        "type": "object",
        "properties": {
          "text": {
            "type": "string"
          },
          "questionStates": {
            "type": "object",
            "propertyNames": {
              "type": "string"
            },
            "additionalProperties": {
              "type": "string",
              "enum": [
                "answered",
                "unknown"
              ]
            }
          }
        },
        "required": [
          "text",
          "questionStates"
        ],
        "additionalProperties": false
      }
    },
    "expectedFacts": {
      "minItems": 1,
      "type": "array",
      "items": {
        "type": "object",
        "properties": {
          "fieldId": {
            "type": "string",
            "enum": [
              "A01",
              "A02",
              "A03",
              "A04",
              "A05",
              "A06",
              "A07",
              "A08",
              "B01",
              "B02",
              "B03",
              "B04",
              "B05",
              "B06",
              "B07",
              "C01",
              "C02",
              "C03",
              "C04",
              "C05",
              "C06",
              "C07",
              "C08",
              "D01",
              "D02",
              "D03",
              "D04",
              "D05",
              "E01",
              "E02",
              "E03",
              "E04",
              "E05",
              "E06",
              "E07",
              "E08",
              "E09",
              "F01",
              "F02",
              "F03",
              "F04",
              "F05",
              "F06",
              "F07",
              "G01",
              "G02",
              "G03",
              "G04",
              "G05",
              "H01",
              "H02",
              "H03",
              "H04",
              "H05",
              "H06",
              "H07",
              "H08",
              "H09",
              "H10",
              "I01",
              "I02",
              "I03",
              "I04",
              "I05",
              "I06",
              "J01",
              "J02",
              "J03",
              "J04",
              "J05",
              "K01",
              "K02",
              "K03",
              "K04",
              "K05",
              "K06",
              "K07",
              "L01",
              "L02",
              "L03",
              "L04",
              "L05",
              "L06",
              "L07",
              "M01",
              "M02",
              "M03",
              "M04",
              "M05",
              "M06",
              "M07",
              "M08",
              "M09",
              "M10",
              "N01",
              "N02",
              "N03",
              "N04",
              "N05",
              "N06",
              "O01",
              "O02",
              "O03",
              "O04",
              "O05",
              "O06",
              "O07",
              "O08",
              "O09",
              "P01",
              "P02",
              "P03",
              "P04",
              "P05",
              "P06",
              "P07",
              "P08"
            ]
          },
          "recordId": {
            "type": "string"
          },
          "value": {
            "anyOf": [
              {
                "type": "string"
              },
              {
                "type": "number"
              },
              {
                "type": "boolean"
              },
              {
                "type": "array",
                "items": {
                  "type": "string"
                }
              },
              {
                "type": "null"
              }
            ]
          },
          "version": {
            "type": "integer",
            "exclusiveMinimum": 0,
            "maximum": 9007199254740991
          },
          "status": {
            "type": "string",
            "enum": [
              "extracted",
              "missing",
              "unclear",
              "conflict",
              "not-applicable"
            ]
          },
          "reviewStatus": {
            "type": "string",
            "enum": [
              "unreviewed",
              "checked",
              "corrected"
            ]
          },
          "sourceIds": {
            "type": "array",
            "items": {
              "type": "string"
            }
          },
          "candidates": {
            "type": "array",
            "items": {
              "type": "object",
              "properties": {
                "value": {
                  "anyOf": [
                    {
                      "type": "string"
                    },
                    {
                      "type": "number"
                    },
                    {
                      "type": "boolean"
                    },
                    {
                      "type": "array",
                      "items": {
                        "type": "string"
                      }
                    },
                    {
                      "type": "null"
                    }
                  ]
                },
                "sourceIds": {
                  "type": "array",
                  "items": {
                    "type": "string"
                  }
                }
              },
              "required": [
                "value",
                "sourceIds"
              ],
              "additionalProperties": false
            }
          },
          "history": {
            "type": "array",
            "items": {
              "type": "object",
              "properties": {
                "value": {
                  "anyOf": [
                    {
                      "type": "string"
                    },
                    {
                      "type": "number"
                    },
                    {
                      "type": "boolean"
                    },
                    {
                      "type": "array",
                      "items": {
                        "type": "string"
                      }
                    },
                    {
                      "type": "null"
                    }
                  ]
                },
                "reason": {
                  "type": "string"
                },
                "sourceIds": {
                  "type": "array",
                  "items": {
                    "type": "string"
                  }
                }
              },
              "required": [
                "value",
                "reason",
                "sourceIds"
              ],
              "additionalProperties": false
            }
          }
        },
        "required": [
          "fieldId",
          "value",
          "version",
          "status",
          "reviewStatus",
          "sourceIds",
          "candidates",
          "history"
        ],
        "additionalProperties": false
      }
    },
    "recommendations": {
      "minItems": 3,
      "maxItems": 3,
      "type": "array",
      "items": {
        "type": "object",
        "properties": {
          "id": {
            "type": "string"
          },
          "guidelineId": {
            "type": "string"
          },
          "guidelineVersion": {
            "type": "number",
            "const": 1
          },
          "step": {
            "type": "string"
          },
          "responsibleRole": {
            "type": "string"
          },
          "priority": {
            "type": "string"
          },
          "dependency": {
            "type": "string"
          },
          "expectedDecision": {
            "type": "string",
            "enum": [
              "accepted",
              "rejected"
            ]
          },
          "reason": {
            "type": [
              "string",
              "null"
            ]
          }
        },
        "required": [
          "id",
          "guidelineId",
          "guidelineVersion",
          "step",
          "responsibleRole",
          "priority",
          "dependency",
          "expectedDecision",
          "reason"
        ],
        "additionalProperties": false
      }
    },
    "bodies": {
      "type": "object",
      "properties": {
        "factualSummary": {
          "type": "string"
        },
        "sharedSummary": {
          "type": "string"
        },
        "bank": {
          "type": "string"
        },
        "telecom": {
          "type": "string"
        }
      },
      "required": [
        "factualSummary",
        "sharedSummary",
        "bank",
        "telecom"
      ],
      "additionalProperties": false
    },
    "bodyConditions": {
      "minItems": 1,
      "type": "array",
      "items": {
        "type": "string"
      }
    },
    "expectedChecks": {
      "minItems": 10,
      "type": "array",
      "items": {
        "type": "object",
        "properties": {
          "name": {
            "type": "string"
          },
          "precondition": {
            "type": "string"
          },
          "expected": {
            "type": "string"
          },
          "forbidden": {
            "type": "string"
          },
          "source": {
            "type": "string"
          }
        },
        "required": [
          "name",
          "precondition",
          "expected",
          "forbidden",
          "source"
        ],
        "additionalProperties": false
      }
    },
    "execution": {
      "type": "string",
      "const": "not-executed"
    }
  },
  "required": [
    "evaluationId",
    "caseId",
    "contentVersion",
    "synthetic",
    "contentApproval",
    "approvalRef",
    "expectationOnly",
    "roleId",
    "input",
    "correction",
    "questions",
    "answers",
    "expectedFacts",
    "recommendations",
    "bodies",
    "bodyConditions",
    "expectedChecks",
    "execution"
  ],
  "additionalProperties": false
}
