{
  "evaluationId": "T09",
  "caseId": "EXAMPLE-01",
  "contentVersion": 1,
  "synthetic": true,
  "contentApproval": "approved",
  "approvalRef": "BUSINESS-BASELINE-01",
  "expectationOnly": true,
  "roleId": "EX-ROLE-01",
  "input": "I received a text message at 09:00 on 16 October 2026 claiming to be SYN Bank A and saying that my account needed verification.\n\nI opened the link at verify-bank.example and entered my online banking password and a one-time code.\n\nAt 09:30 I noticed an unfamiliar AUD 2,000 debit in my SYN Bank A app; I do not know whether it is pending or completed.\n\nI use SYN Telco B for my mobile service, and I have not contacted either organisation about this yet.\n\nI have the text message on my phone, but I have not provided any material to the employee.",
  "correction": {
    "target": {
      "fieldId": "E04",
      "recordId": "TX-01"
    },
    "from": 2000,
    "to": 200,
    "text": "The amount was entered incorrectly. The reported debit is AUD 200, not AUD 2,000."
  },
  "questions": [
    {
      "id": "Q1",
      "target": {
        "fieldId": "E09",
        "recordId": "TX-01"
      },
      "text": "Is the debit shown as pending or completed?",
      "reason": "Transaction status affects the bank record and human assessment."
    },
    {
      "id": "Q2",
      "target": {
        "fieldId": "C08",
        "recordId": "CONTACT-01"
      },
      "text": "Has the sender contacted you again?",
      "reason": "Establish whether this contact is continuing."
    },
    {
      "id": "Q3",
      "target": {
        "fieldId": "E08",
        "recordId": "TX-01"
      },
      "text": "Does the bank app identify the recipient of the debit?",
      "reason": "The recipient affects the human assessment record and is not provided."
    }
  ],
  "answers": [
    {
      "text": "The app says pending.",
      "questionStates": {
        "Q1": "answered"
      }
    },
    {
      "text": "I do not know whether there were more messages. I cannot identify the recipient from the app.",
      "questionStates": {
        "Q2": "unknown",
        "Q3": "unknown"
      }
    }
  ],
  "expectedFacts": [
    {
      "fieldId": "A07",
      "value": "I received a text message at 09:00 on 16 October 2026 claiming to be SYN Bank A and saying that my account needed verification.\n\nI opened the link at verify-bank.example and entered my online banking password and a one-time code.\n\nAt 09:30 I noticed an unfamiliar AUD 2,000 debit in my SYN Bank A app; I do not know whether it is pending or completed.\n\nI use SYN Telco B for my mobile service, and I have not contacted either organisation about this yet.\n\nI have the text message on my phone, but I have not provided any material to the employee.",
      "version": 1,
      "status": "extracted",
      "reviewStatus": "checked",
      "sourceIds": [
        "S1",
        "S2",
        "S3",
        "S4",
        "S5"
      ],
      "candidates": [],
      "history": []
    },
    {
      "fieldId": "B01",
      "value": "Person concerned",
      "version": 1,
      "status": "extracted",
      "reviewStatus": "checked",
      "sourceIds": [
        "S1",
        "S2",
        "S3",
        "S4",
        "S5"
      ],
      "candidates": [],
      "history": []
    },
    {
      "fieldId": "C02",
      "recordId": "CONTACT-01",
      "value": "16 October 2026 09:00 Australia/Sydney",
      "version": 1,
      "status": "extracted",
      "reviewStatus": "checked",
      "sourceIds": [
        "S1"
      ],
      "candidates": [],
      "history": []
    },
    {
      "fieldId": "C03",
      "recordId": "CONTACT-01",
      "value": "SMS",
      "version": 1,
      "status": "extracted",
      "reviewStatus": "checked",
      "sourceIds": [
        "S1"
      ],
      "candidates": [],
      "history": []
    },
    {
      "fieldId": "C04",
      "recordId": "CONTACT-01",
      "value": "Claims to be SYN Bank A",
      "version": 1,
      "status": "extracted",
      "reviewStatus": "checked",
      "sourceIds": [
        "S1"
      ],
      "candidates": [],
      "history": []
    },
    {
      "fieldId": "C06",
      "recordId": "CONTACT-01",
      "value": "verify-bank.example",
      "version": 1,
      "status": "extracted",
      "reviewStatus": "checked",
      "sourceIds": [
        "S2"
      ],
      "candidates": [],
      "history": []
    },
    {
      "fieldId": "C08",
      "recordId": "CONTACT-01",
      "value": null,
      "version": 1,
      "status": "missing",
      "reviewStatus": "checked",
      "sourceIds": [],
      "candidates": [],
      "history": []
    },
    {
      "fieldId": "D04",
      "recordId": "EVENT-01",
      "value": "Opened the link and entered banking password and one-time code categories; no secret values recorded.",
      "version": 1,
      "status": "extracted",
      "reviewStatus": "checked",
      "sourceIds": [
        "S2"
      ],
      "candidates": [],
      "history": []
    },
    {
      "fieldId": "E01",
      "value": "Reported debit",
      "version": 1,
      "status": "extracted",
      "reviewStatus": "checked",
      "sourceIds": [
        "S3"
      ],
      "candidates": [],
      "history": []
    },
    {
      "fieldId": "E02",
      "recordId": "TX-01",
      "value": "TX-01",
      "version": 1,
      "status": "extracted",
      "reviewStatus": "checked",
      "sourceIds": [
        "S3"
      ],
      "candidates": [],
      "history": []
    },
    {
      "fieldId": "E03",
      "recordId": "TX-01",
      "value": null,
      "version": 1,
      "status": "missing",
      "reviewStatus": "checked",
      "sourceIds": [],
      "candidates": [],
      "history": []
    },
    {
      "fieldId": "E04",
      "recordId": "TX-01",
      "value": 200,
      "version": 2,
      "status": "extracted",
      "reviewStatus": "corrected",
      "sourceIds": [
        "S3"
      ],
      "candidates": [],
      "history": [
        {
          "value": 2000,
          "reason": "The amount was entered incorrectly. The reported debit is AUD 200, not AUD 2,000.",
          "sourceIds": [
            "S3"
          ]
        }
      ]
    },
    {
      "fieldId": "E05",
      "recordId": "TX-01",
      "value": "AUD",
      "version": 1,
      "status": "extracted",
      "reviewStatus": "checked",
      "sourceIds": [
        "S3"
      ],
      "candidates": [],
      "history": []
    },
    {
      "fieldId": "E06",
      "recordId": "TX-01",
      "value": null,
      "version": 1,
      "status": "missing",
      "reviewStatus": "checked",
      "sourceIds": [],
      "candidates": [],
      "history": []
    },
    {
      "fieldId": "E07",
      "recordId": "TX-01",
      "value": "SYN Bank A",
      "version": 1,
      "status": "extracted",
      "reviewStatus": "checked",
      "sourceIds": [
        "S3"
      ],
      "candidates": [],
      "history": []
    },
    {
      "fieldId": "E08",
      "recordId": "TX-01",
      "value": null,
      "version": 1,
      "status": "missing",
      "reviewStatus": "checked",
      "sourceIds": [],
      "candidates": [],
      "history": []
    },
    {
      "fieldId": "E09",
      "recordId": "TX-01",
      "value": "reported pending",
      "version": 2,
      "status": "extracted",
      "reviewStatus": "checked",
      "sourceIds": [
        "Q1"
      ],
      "candidates": [],
      "history": []
    },
    {
      "fieldId": "F01",
      "value": true,
      "version": 1,
      "status": "extracted",
      "reviewStatus": "checked",
      "sourceIds": [
        "S2"
      ],
      "candidates": [],
      "history": []
    },
    {
      "fieldId": "F02",
      "value": [
        "Banking password",
        "One-time code"
      ],
      "version": 1,
      "status": "extracted",
      "reviewStatus": "checked",
      "sourceIds": [
        "S2"
      ],
      "candidates": [],
      "history": []
    },
    {
      "fieldId": "F03",
      "value": "Linked page",
      "version": 1,
      "status": "extracted",
      "reviewStatus": "checked",
      "sourceIds": [
        "S2"
      ],
      "candidates": [],
      "history": []
    },
    {
      "fieldId": "F05",
      "value": "SYN Bank A online banking",
      "version": 1,
      "status": "extracted",
      "reviewStatus": "checked",
      "sourceIds": [
        "S2",
        "S3"
      ],
      "candidates": [],
      "history": []
    },
    {
      "fieldId": "F06",
      "value": [
        "Unfamiliar debit"
      ],
      "version": 1,
      "status": "extracted",
      "reviewStatus": "checked",
      "sourceIds": [
        "S3"
      ],
      "candidates": [],
      "history": []
    },
    {
      "fieldId": "F07",
      "value": "16 October 2026 09:30 Australia/Sydney",
      "version": 1,
      "status": "extracted",
      "reviewStatus": "checked",
      "sourceIds": [
        "S3"
      ],
      "candidates": [],
      "history": []
    },
    {
      "fieldId": "J02",
      "recordId": "EVID-01",
      "value": "Text message",
      "version": 1,
      "status": "extracted",
      "reviewStatus": "checked",
      "sourceIds": [
        "S5"
      ],
      "candidates": [],
      "history": []
    },
    {
      "fieldId": "J04",
      "recordId": "EVID-01",
      "value": "Reported available on phone; not provided or verified",
      "version": 1,
      "status": "extracted",
      "reviewStatus": "checked",
      "sourceIds": [
        "S5"
      ],
      "candidates": [],
      "history": []
    }
  ],
  "recommendations": [
    {
      "id": "REC-01",
      "guidelineId": "EX-G01",
      "guidelineVersion": 1,
      "step": "Prepare the local bank internal human assessment record.",
      "responsibleRole": "SYN Bank A / Intake Officer",
      "priority": "Prioritise human assessment of the reported pending unfamiliar debit.",
      "dependency": "May be prepared in parallel with REC-02; transaction facts remain reported and unverified.",